{
  "referentie": "Casus 1 - Eenvoudige correcte afrekening (appartement, zelfstandig, boekjaar 2024)",
  "woonruimte": {
    "zelfstandig": true,
    "woningtype": "flatwoning_appartement",
    "oppervlakte_m2": 72,
    "aantal_bewoners": 2,
    "aantal_woonruimten_op_aansluiting": 1,
    "aantal_woonruimten_complex": 40
  },
  "periode": { "jaar": 2024, "maand_van": 1, "maand_tot_en_met": 12 },
  "procedure": {
    "contract_gesloten_op": "2022-03-01",
    "sector": "sociaal",
    "afrekening_ontvangen": true,
    "afrekening_ontvangen_op": "2025-05-15",
    "bezwaar_gemaakt": true,
    "verzoekdatum": "2025-08-01",
    "huurder_woont_nog_op_adres": true
  },
  "voorschot_in_rekening_gebracht": "1200.00",
  "kostenposten": [
    {
      "id": "P1", "categorie": "NUT-ELK-METER",
      "omschrijving": "Elektriciteit eigen meter",
      "bedrag_verhuurder": "602.15",
      "overeengekomen": true,
      "bewijs": ["facturen", "meterstanden"],
      "parameters": { "beginstand": 14320, "eindstand": 17110, "verbruik_verhuurder": 2790 }
    },
    {
      "id": "P2", "categorie": "SK-04-SCHOONMAAK",
      "omschrijving": "Schoonmaak gemeenschappelijke ruimten",
      "bedrag_verhuurder": "180.00",
      "overeengekomen": true,
      "bewijs": ["facturen", "specificatieformulier"],
      "parameters": { "betreft_mutatiekosten": false, "betreft_gemeenschappelijke_voorziening": true, "werkelijke_kosten": "7200.00", "aantal_woonruimten": 40 }
    },
    {
      "id": "P3", "categorie": "SK-06",
      "omschrijving": "Huismeester",
      "bedrag_verhuurder": "149.33",
      "overeengekomen": true,
      "bewijs": ["facturen", "urenverantwoording"],
      "parameters": { "uren": 800, "totale_kosten": "32000.00", "aantal_woonruimten": 150 }
    },
    {
      "id": "P4", "categorie": "SK-11",
      "omschrijving": "Administratiekosten",
      "bedrag_verhuurder": "16.47",
      "bewijs": ["specificatieformulier"],
      "parameters": { "afrekening_verstrekt": true, "grondslag_overige_posten": "329.33" }
    }
  ]
}
